{
  "summary": "Michelle recently transitioned to aerospace engineering after a successful career in business, driven by a newfound passion for aviation. While her aviation journey is nascent, she demonstrates strong character through her commitment to adult learning and clear vision for contributing to the aerospace industry. Her leadership experience in her previous career, combined with her service mindset, positions her well for success in aviation.",
  "profile_features": {
    "motivation_summary": "Michelle's interest in aviation developed through volunteer work with an aerospace nonprofit. Inspired by the mission of supporting underrepresented women in STEM, she decided to pursue aerospace engineering as a second career.",
    "career_goals_summary": "Michelle seeks to work in aerospace engineering with a focus on supporting diversity and inclusion initiatives. She hopes to eventually lead programs that encourage women to enter aviation and aerospace fields.",
    "aviation_path_stage": "exploring",
    "community_service_summary": "Volunteer coordinator for women in STEM nonprofit; mentors undergraduate women in engineering; serves on diversity committee for engineering department.",
    "leadership_roles": [
      "Volunteer Coordinator, Women in STEM Nonprofit",
      "Diversity Committee Member, Engineering Department",
      "Peer Mentor for Women in Engineering"
    ],
    "personal_character_indicators": [
      "adaptability",
      "commitment to learning",
      "service-oriented",
      "collaboration",
      "strategic thinking",
      "inclusivity"
    ],
    "alignment_with_wai": "Michelle's commitment to supporting women in aviation and aerospace through both her career transition and volunteer work directly aligns with WAI's advocacy and support mission.",
    "unique_strengths": [
      "Brings diverse professional experience to aerospace field",
      "Strong commitment to diversity and inclusion",
      "Proven leadership in previous career",
      "Mature perspective and intentional career planning"
    ]
  },
  "scores": {
    "motivation_score": 75,
    "goals_clarity_score": 78,
    "character_service_leadership_score": 82,
    "overall_score": 78
  },
  "score_breakdown": {
    "motivation_score_reasoning": "While Michelle's aviation motivation is emerging rather than lifelong, her thoughtful career transition and commitment to the field through action demonstrates genuine interest.",
    "goals_clarity_score_reasoning": "Goals are clear and focused on using aviation/aerospace to support diversity initiatives, with realistic pathways articulated.",
    "character_service_leadership_score_reasoning": "Excellent character indicators with proven leadership from previous career and strong ongoing commitment to service through mentoring and committee work.",
    "overall_score_reasoning": "Michelle shows strong scholarship fit through her character, service orientation, and unique perspective that could benefit the aviation community."
  }
}
