{
  "summary": "Sarah demonstrates deep passion for aviation through both her academic pursuits and community involvement. With clear career goals to become a commercial pilot and active leadership in her school's aerospace club, she shows strong alignment with WAI's mission. Her persistence in pursuing flight training while maintaining excellent grades, combined with her commitment to mentoring younger students, indicates both dedication and character.",
  "profile_features": {
    "motivation_summary": "Sarah's passion for aviation began at age 12 when her uncle took her flying. She has since earned her private pilot license and is actively working toward her commercial license while maintaining a 3.8 GPA in aerospace engineering.",
    "career_goals_summary": "Sarah aspires to become a commercial airline pilot, with a long-term goal of working for a major carrier. She is particularly interested in mentoring the next generation of women pilots.",
    "aviation_path_stage": "training",
    "community_service_summary": "Secretary of school aerospace club; volunteers at local aviation museum teaching children about aviation careers; mentors 3 high school students interested in aviation.",
    "leadership_roles": [
      "Aerospace Club Secretary",
      "Flight Training Mentor",
      "Aviation Museum Youth Programs Volunteer Coordinator"
    ],
    "personal_character_indicators": [
      "persistence",
      "dedication",
      "mentorship",
      "initiative",
      "teamwork",
      "resilience"
    ],
    "alignment_with_wai": "Sarah's commitment to aviation, demonstrated through both personal achievement and commitment to supporting other women in aviation, strongly aligns with WAI's core mission.",
    "unique_strengths": [
      "Early achievement in flight training",
      "Strong academic record",
      "Active in promoting aviation to younger generation",
      "Clear long-term career vision"
    ]
  },
  "scores": {
    "motivation_score": 92,
    "goals_clarity_score": 88,
    "character_service_leadership_score": 85,
    "overall_score": 88
  },
  "score_breakdown": {
    "motivation_score_reasoning": "Sarah demonstrates exceptionally strong and genuine motivation for aviation, backed by concrete actions including private pilot license and ongoing flight training.",
    "goals_clarity_score_reasoning": "Career goals are specific and well-articulated with both short-term (commercial license) and long-term (airline pilot role) objectives.",
    "character_service_leadership_score_reasoning": "Strong leadership through aerospace club role and demonstrated commitment to community service through youth mentoring and museum volunteering.",
    "overall_score_reasoning": "Sarah shows excellent alignment with scholarship criteria with strong motivation, clear goals, demonstrated leadership, and commitment to supporting other women in aviation."
  }
}
